{
  "$schema": "../catalog_entry.schema.json",
  "id": "dnd5e",
  "ref": "dnd5e/system/dnd5e",
  "name": "Dungeons & Dragons fifth edition — System Reference Document 5.2.1",
  "schema_version": "1.0",
  "source": {
    "system": "dnd5e",
    "document": "srd-5.2.1",
    "origin": "official",
    "pages": [
      1,
      5
    ],
    "section": "System",
    "license": {
      "id": "CC-BY-4.0",
      "attribution": "This work includes material from the System Reference Document 5.2.1 (“SRD 5.2.1”) by Wizards of the Coast LLC, available at https://www.dndbeyond.com/srd. The SRD 5.2.1 is licensed under the Creative Commons Attribution 4.0 International License, available at https://creativecommons.org/licenses/by/4.0/legalcode."
    },
    "extracted_by": "L02"
  },
  "core_rules": [
    {
      "id": "general_rules",
      "text": "General rules govern each part of the game. For example, the combat rules tell you that melee attacks use Strength and ranged attacks use Dexterity. That’s a general rule, and a general rule is in effect as long as something in the game doesn’t explicitly say otherwise.",
      "pages": [
        5
      ]
    },
    {
      "id": "exceptions_supersede",
      "text": "When an exception and a general rule disagree, the exception wins.",
      "pages": [
        5
      ],
      "data": {
        "precedence": [
          "specific_exception",
          "general_rule"
        ]
      }
    }
  ],
  "core_die": {
    "die": "d20",
    "rules": [
      {
        "id": "d20_test.kinds",
        "text": "When the outcome of an action is uncertain, the game uses a d20 roll to determine success or failure. These rolls are called D20 Tests, and they come in three kinds: ability checks, saving throws, and attack rolls.",
        "pages": [
          6
        ],
        "data": {
          "kinds": [
            "ability_check",
            "saving_throw"
          ]
        }
      },
      {
        "id": "d20_test.step_roll",
        "text": "Roll 1d20. You always want to roll high.",
        "pages": [
          6
        ],
        "data": {
          "roll": "1d20"
        }
      }
    ]
  },
  "abilities": [
    {
      "id": "str",
      "name": "Strength",
      "abbreviation": "Str.",
      "measures": "Physical might",
      "pages": [
        5
      ]
    },
    {
      "id": "dex",
      "name": "Dexterity",
      "abbreviation": "Dex.",
      "measures": "Agility, reflexes, and balance",
      "pages": [
        5
      ]
    }
  ],
  "ability_scores": {
    "min": 1,
    "max": 30,
    "descriptors": [
      {
        "id": "ability_score.range_1_1",
        "text": "This is the lowest a score can normally go. If an effect reduces a score to 0, that effect explains what happens.",
        "pages": [
          5
        ],
        "data": {
          "min": 1,
          "max": 1
        }
      },
      {
        "id": "ability_score.range_2_9",
        "text": "This represents a weak capability.",
        "pages": [
          5
        ],
        "data": {
          "min": 2,
          "max": 9
        }
      }
    ],
    "modifier_table": [
      {
        "min": 1,
        "max": 1,
        "modifier": -5
      },
      {
        "min": 2,
        "max": 3,
        "modifier": -4
      }
    ],
    "pages": [
      5,
      6
    ]
  },
  "skills": [
    {
      "id": "acrobatics",
      "name": "Acrobatics",
      "ability": "dex",
      "example_uses": "Stay on your feet in a tricky situation, or perform an acrobatic stunt.",
      "pages": [
        9
      ]
    },
    {
      "id": "animal_handling",
      "name": "Animal Handling",
      "ability": "wis",
      "example_uses": "Calm or train an animal, or get an animal to behave in a certain way.",
      "pages": [
        9
      ]
    }
  ],
  "proficiency_bonus": {
    "by_level": {
      "1": 2,
      "2": 2,
      "3": 2,
      "4": 2,
      "5": 3,
      "6": 3,
      "7": 3,
      "8": 3,
      "9": 4,
      "10": 4,
      "11": 4,
      "12": 4,
      "13": 5,
      "14": 5,
      "15": 5,
      "16": 5,
      "17": 6,
      "18": 6,
      "19": 6,
      "20": 6
    },
    "by_challenge_rating": [
      {
        "min": 0,
        "max": 4,
        "bonus": 2
      },
      {
        "min": 5,
        "max": 8,
        "bonus": 3
      }
    ],
    "rules": [
      {
        "id": "proficiency_bonus.once",
        "text": "Your Proficiency Bonus can’t be added to a die roll or another number more than once.",
        "pages": [
          8
        ],
        "data": {
          "max_additions": 1
        }
      },
      {
        "id": "proficiency_bonus.multiply_divide_once",
        "text": "Whenever the bonus is used, it can be multiplied only once and divided only once.",
        "pages": [
          8
        ],
        "data": {
          "max_multiplications": 1,
          "max_divisions": 1
        }
      }
    ],
    "pages": [
      8,
      23
    ]
  },
  "levels": {
    "min": 1,
    "max": 20,
    "advancement": [
      {
        "level": 1,
        "xp": 0,
        "proficiency_bonus": 2
      },
      {
        "level": 2,
        "xp": 300,
        "proficiency_bonus": 2
      }
    ],
    "tiers": [
      {
        "id": "tier_1",
        "text": "In tier 1, characters are apprentice adventurers",
        "pages": [
          24
        ],
        "data": {
          "min_level": 1,
          "max_level": 4
        }
      },
      {
        "id": "tier_2",
        "text": "In tier 2, characters are full-fledged adventurers.",
        "pages": [
          24
        ],
        "data": {
          "min_level": 5,
          "max_level": 10
        }
      }
    ],
    "rules": [
      {
        "id": "level.threshold",
        "text": "When your XP total equals or exceeds a number in the Experience Points column, you reach the corresponding level.",
        "pages": [
          23
        ],
        "data": {
          "comparison": ">="
        }
      },
      {
        "id": "level.hit_points",
        "text": "Each time you gain a level, you gain an additional Hit Die. Roll that die, add your Constitution modifier to the roll, and add the total (minimum of 1) to your Hit Point maximum. Instead of rolling, you can use the fixed value shown in the Fixed Hit Points by Class table.",
        "pages": [
          23
        ],
        "data": {
          "hit_dice_gained": 1,
          "hp_gain": "roll_hit_die_plus_con_mod_min_1_or_fixed",
          "minimum": 1
        }
      }
    ],
    "pages": [
      23,
      24
    ]
  },
  "action_economy": [
    {
      "id": "action",
      "name": "Action",
      "per": "turn",
      "count": 1,
      "refreshes_on": "turn_start",
      "rules": [
        {
          "id": "turn.action_and_move",
          "text": "On your turn, you can move a distance up to your Speed and take one action.",
          "pages": [
            13
          ]
        },
        {
          "id": "action.one_at_a_time",
          "text": "You can take only one action at a time.",
          "pages": [
            10
          ]
        }
      ],
      "pages": [
        9,
        13
      ]
    },
    {
      "id": "bonus_action",
      "name": "Bonus Action",
      "per": "turn",
      "count": 1,
      "refreshes_on": "turn_start",
      "rules": [
        {
          "id": "bonus_action.granted_only",
          "text": "You can take a Bonus Action only when a special ability, a spell, or another feature of the game states that you can do something as a Bonus Action. You otherwise don’t have a Bonus Action to take.",
          "pages": [
            10
          ]
        },
        {
          "id": "bonus_action.one_per_turn",
          "text": "You can take only one Bonus Action on your turn",
          "pages": [
            10
          ]
        }
      ],
      "pages": [
        10
      ]
    }
  ],
  "initiative": {
    "check": "dex",
    "rules": [
      {
        "id": "initiative.check",
        "text": "When combat starts, every participant rolls Initiative; they make a Dexterity check that determines their place in the Initiative order.",
        "pages": [
          13
        ],
        "data": {
          "ability": "dex"
        }
      },
      {
        "id": "initiative.groups",
        "text": "The GM rolls for monsters. For a group of identical creatures, the GM makes a single roll, so each member of the group has the same Initiative.",
        "pages": [
          13
        ],
        "data": {
          "identical_creatures": "single_roll"
        }
      }
    ],
    "pages": [
      13
    ]
  },
  "rests": [
    {
      "id": "short_rest",
      "name": "Short Rest",
      "ref": "dnd5e/rule/short-rest",
      "minimum_duration": {
        "kind": "hours",
        "amount": 1,
        "text": "1-hour period"
      },
      "pages": [
        187
      ]
    },
    {
      "id": "long_rest",
      "name": "Long Rest",
      "ref": "dnd5e/rule/long-rest",
      "minimum_duration": {
        "kind": "hours",
        "amount": 8,
        "text": "at least 8 hours"
      },
      "pages": [
        185
      ]
    }
  ],
  "languages": [
    {
      "id": "common",
      "name": "Common",
      "category": "standard",
      "roll": "—",
      "pages": [
        20
      ]
    },
    {
      "id": "common_sign_language",
      "name": "Common Sign Language",
      "category": "standard",
      "roll": "1",
      "pages": [
        20
      ]
    }
  ],
  "currency": [
    {
      "id": "cp",
      "name": "Copper Piece",
      "abbreviation": "CP",
      "value_in_cp": 1.0,
      "pages": [
        89
      ]
    },
    {
      "id": "sp",
      "name": "Silver Piece",
      "abbreviation": "SP",
      "value_in_cp": 10.0,
      "pages": [
        89
      ]
    }
  ],
  "units": {
    "distance": {
      "unit": "foot",
      "pages": [
        188
      ]
    },
    "long_distance": {
      "unit": "mile",
      "pages": [
        12